;question;answer
65;[<p>Две бесконечные параллельные пластины равномерно заряжены поверхностной плотностью заряда 1 и -3 нКл/м<sup>2</sup>. Определить напряженность поля между пластинами.</p>, <p><em>Задача №6.2.35 из «Сборника задач для подготовки к вступительным экзаменам по физике УГНТУ»</em></p>];"[<p>\(\sigma_1=1\) нКл/м<sup>2</sup>, \(\sigma_2=-3\) нКл/м<sup>2</sup>, \(E-?\)</p>, <p><a class=""fancybox"" href=""http://easyfizika.ru/wp-content/uploads/2017/08/Shema-k-resheniyu-zadachi-18.jpg""><span itemprop=""image"" itemscope="""" itemtype=""https://schema.org/ImageObject""><img alt=""Схема к решению задачи"" class=""alignright wp-image-8643 size-medium"" height=""300"" itemprop=""url image"" sizes=""(max-width: 266px) 100vw, 266px"" src=""http://easyfizika.ru/wp-content/uploads/2017/08/Shema-k-resheniyu-zadachi-18-266x300.jpg"" srcset=""http://easyfizika.ru/wp-content/uploads/2017/08/Shema-k-resheniyu-zadachi-18-266x300.jpg 266w, http://easyfizika.ru/wp-content/uploads/2017/08/Shema-k-resheniyu-zadachi-18-133x150.jpg 133w, http://easyfizika.ru/wp-content/uploads/2017/08/Shema-k-resheniyu-zadachi-18.jpg 636w"" width=""266""/><meta content=""266"" itemprop=""width""/><meta content=""300"" itemprop=""height""/></span></a>Каждая из пластин будет создавать электрическое поле, направление напряженности каждого поля показано на схеме. Модуль напряженностей полей \(E_1\) и \(E_2\) можно найти по формулам:</p>, <p>\[\left\{ \begin{gathered}<br/> {E_1} = \frac{{{\sigma _1}}}{{2{\varepsilon _0}}} \hfill \\<br/> {E_2} = \frac{{\left| {{\sigma _2}} \right|}}{{2{\varepsilon _0}}} \hfill \\<br/> \end{gathered} \right.\]</p>, <p>Здесь \(\varepsilon _0\) – электрическая постоянная, равная 8,85·10<sup>-12</sup> Ф/м.</p>, <p>Раскроем модуль во второй формуле (так как \(\sigma_2&lt;0\), то \(\left| {{\sigma _2}} \right| = – {\sigma _2}\)), тогда:</p>, <p>\[\left\{ \begin{gathered}<br/> {E_1} = \frac{{{\sigma _1}}}{{2{\varepsilon _0}}} \hfill \\<br/> {E_2} = \frac{{ – {\sigma _2}}}{{2{\varepsilon _0}}} \hfill \\<br/> \end{gathered} \right.\]</p>, <p>Так как напряженности \(E_1\) и \(E_2\) сонаправлены, то результирующее электрическое поле \(E\) определим следующим образом:</p>, <p>\[E = {E_1} + {E_2}\]</p>, <p>\[E = \frac{{{\sigma _1}}}{{2{\varepsilon _0}}} – \frac{{{\sigma _2}}}{{2{\varepsilon _0}}}\]</p>, <p>\[E = \frac{{{\sigma _1} – {\sigma _2}}}{{2{\varepsilon _0}}}\]</p>, <p>Посчитаем численный ответ задачи:</p>, <p>\[E = \frac{{1 \cdot {{10}^{ – 9}} – \left( { – 3 \cdot {{10}^{ – 9}}} \right)}}{{2 \cdot 8,85 \cdot {{10}^{ – 12}}}} = 226\;В/м = 2,26\;В/см\]</p>]"
66;[<p>Две плоские пластинки площадью 200 см<sup>2</sup>, расстояние между которыми очень мало, находясь в керосине, притягиваются с силой 25 мН. Определить величину заряда пластин.</p>, <p><em>Задача №6.2.36 из «Сборника задач для подготовки к вступительным экзаменам по физике УГНТУ»</em></p>];"[<p>\(S=200\) см<sup>2</sup>, \(F=25\) мН, \(q-?\)</p>, <p><a class=""fancybox"" href=""http://easyfizika.ru/wp-content/uploads/2017/08/Shema-k-resheniyu-zadachi-19.jpg""><span itemprop=""image"" itemscope="""" itemtype=""https://schema.org/ImageObject""><img alt=""Схема к решению задачи"" class=""alignright wp-image-8650 size-medium"" height=""194"" itemprop=""url image"" sizes=""(max-width: 300px) 100vw, 300px"" src=""http://easyfizika.ru/wp-content/uploads/2017/08/Shema-k-resheniyu-zadachi-19-300x194.jpg"" srcset=""http://easyfizika.ru/wp-content/uploads/2017/08/Shema-k-resheniyu-zadachi-19-300x194.jpg 300w, http://easyfizika.ru/wp-content/uploads/2017/08/Shema-k-resheniyu-zadachi-19-150x97.jpg 150w, http://easyfizika.ru/wp-content/uploads/2017/08/Shema-k-resheniyu-zadachi-19.jpg 875w"" width=""300""/><meta content=""300"" itemprop=""width""/><meta content=""194"" itemprop=""height""/></span></a>Будем полагать, что пластины заряжены одинаковыми по величине, но разными по знаку зарядами (как в конденсаторе), так как в условии ничего про это не сказано.</p>, <p>Силу электрического притяжения пластин \(F\) можно определить по формуле:</p>, <p>\[F = Eq\;\;\;\;(1)\]</p>, <p>Здесь \(q\) – заряд одной из пластин (например, положительной), а \(E\) – напряженность электрического поля другой пластины (уже отрицательной). Вторую можно определить по формуле:</p>, <p>\[E = \frac{\sigma }{{2\varepsilon {\varepsilon _0}}}\]</p>, <p>Здесь \(\varepsilon\) – диэлектрическая проницаемость керосина, равная 2, \(\varepsilon_0\) – диэлектрическая постоянная, равная 8,85·10<sup>-12</sup> Ф/м, \(\sigma\) – модуль поверхностной плотности заряда, которую можно найти по формуле:</p>, <p>\[\sigma = \frac{q}{S}\]</p>, <p>Отметим, что здесь \(q\) – это модуль заряда.</p>, <p>Тогда:</p>, <p>\[E = \frac{q}{{2\varepsilon {\varepsilon _0}S}}\]</p>, <p>Полученную формулу подставим в (1):</p>, <p>\[F = \frac{{{q^2}}}{{2\varepsilon {\varepsilon _0}S}}\]</p>, <p>Откуда получим такое решение задачи в общем виде:</p>, <p>\[q = \sqrt {2\varepsilon {\varepsilon _0}FS} \]</p>, <p>Произведём расчёты:</p>, <p>\[q = \sqrt {2 \cdot 2 \cdot 8,85 \cdot {{10}^{ – 12}} \cdot 25 \cdot {{10}^{ – 3}} \cdot 200 \cdot {{10}^{ – 4}}} = 133 \cdot {10^{ – 9}}\;Кл = 133\;нКл\]</p>]"
67;[<p>Две бесконечные плоскости, заряженные с поверхностной плотностью 2 и 0,6 мкКл/м<sup>2</sup>, пересекаются под прямым углом. С какой силой электрическое поле плоскостей действует на заряд 1 нКл, находящийся на биссектрисе угла между плоскостями?</p>, <p><em>Задача №6.2.37 из «Сборника задач для подготовки к вступительным экзаменам по физике УГНТУ»</em></p>];"[<p>\(\sigma_1=2\) мкКл/м<sup>2</sup>, \(\sigma_2=0,6\) мкКл/м<sup>2</sup>, \(q=1\) нКл, \(F-?\)</p>, <p><a class=""fancybox"" href=""http://easyfizika.ru/wp-content/uploads/2017/08/Shema-k-resheniyu-zadachi-20.jpg""><span itemprop=""image"" itemscope="""" itemtype=""https://schema.org/ImageObject""><img alt=""Схема к решению задачи"" class=""alignright wp-image-8657 size-medium"" height=""190"" itemprop=""url image"" sizes=""(max-width: 300px) 100vw, 300px"" src=""http://easyfizika.ru/wp-content/uploads/2017/08/Shema-k-resheniyu-zadachi-20-300x190.jpg"" srcset=""http://easyfizika.ru/wp-content/uploads/2017/08/Shema-k-resheniyu-zadachi-20-300x190.jpg 300w, http://easyfizika.ru/wp-content/uploads/2017/08/Shema-k-resheniyu-zadachi-20-150x95.jpg 150w, http://easyfizika.ru/wp-content/uploads/2017/08/Shema-k-resheniyu-zadachi-20-1024x649.jpg 1024w, http://easyfizika.ru/wp-content/uploads/2017/08/Shema-k-resheniyu-zadachi-20.jpg 1210w"" width=""300""/><meta content=""300"" itemprop=""width""/><meta content=""190"" itemprop=""height""/></span></a>Каждая заряженная плоскость создаёт электрическое поле, модули напряженностей которых \(E_1\) и \(E_2\) можно определить по следующим формулам:</p>, <p>\[\left\{ \begin{gathered}<br/> {E_1} = \frac{{{\sigma _1}}}{{2{\varepsilon _0}}} \hfill \\<br/> {E_2} = \frac{{{\sigma _2}}}{{2{\varepsilon _0}}} \hfill \\<br/> \end{gathered} \right.\]</p>, <p>Так как плоскости пересекаются под прямым углом, то результирующее электрическое поле двух пластин \(E\) можно найти как геометрическую сумму векторов напряженностей \(\overrightarrow {{E_1}}\) и \(\overrightarrow {{E_2}}\) по теореме Пифагора:</p>, <p>\[E = \sqrt {E_1^2 + E_2^2} \]</p>, <p>\[E = \sqrt {\frac{{\sigma _1^2}}{{4\varepsilon _0^2}} + \frac{{\sigma _2^2}}{{4\varepsilon _0^2}}} \]</p>, <p>\[E = \sqrt {\frac{{\sigma _1^2 + \sigma _2^2}}{{4\varepsilon _0^2}}} \]</p>, <p>Искомую же силу \(F\) определим так:</p>, <p>\[F = Eq\]</p>, <p>\[F = \sqrt {\frac{{\sigma _1^2 + \sigma _2^2}}{{4\varepsilon _0^2}}} q\]</p>, <p>\[F = \frac{q}{{2{\varepsilon _0}}}\sqrt {\sigma _1^2 + \sigma _2^2} \]</p>, <p>Задача решена, теперь произведём вычисления:</p>, <p>\[F = \frac{{{{10}^{ – 9}}}}{{2 \cdot 8,85 \cdot {{10}^{ – 12}}}}\sqrt {{{\left( {2 \cdot {{10}^{ – 6}}} \right)}^2} + {{\left( {0,6 \cdot {{10}^{ – 6}}} \right)}^2}} = 118 \cdot {10^{ – 6}}\;Н = 118\;мкН\]</p>]"
68;[<p>Напряженность электрического поля вблизи земли перед разрядом молнии иногда достигает 3 МВ/м. Какая сила действует на пылинку, имеющую заряд 40 нКл, находящуюся в этом поле?</p>, <p><em>Задача №6.2.38 из «Сборника задач для подготовки к вступительным экзаменам по физике УГНТУ»</em></p>];"[<p>\(E=3\) МВ/м, \(q=40\) нКл, \(F-?\)</p>, <p>Перед вами очень простая задача, которая решается, как говорится, в одну формулу. Силу, действующую на заряд \(q\) со стороны электрического поля напряженностью \(E\), можно определить по формуле:</p>, <p>\[F = Eq\]</p>, <p>При этом вектор силы \(\overrightarrow F\) будет направлен в ту же сторону, что и вектор напряженности поля \(\overrightarrow E\), так как заряд \(q\) – положительный.</p>, <p>Посчитаем численное значение силы \(F\):</p>, <p>\[F = 3 \cdot {10^6} \cdot 40 \cdot {10^{ – 9}} = 0,12\;Н\]</p>]"
69;[<p>Между горизонтальными пластинами заряженного конденсатора, напряженность электрического поля которого 50 В/м, находится в равновесии пылинка, имеющая заряд 20 нКл. Какова её масса?</p>, <p><em>Задача №6.2.39 из «Сборника задач для подготовки к вступительным экзаменам по физике УГНТУ»</em></p>];"[<p>\(E=50\) В/м, \(q=20\) нКл, \(m-?\)</p>, <p><a class=""fancybox"" href=""http://easyfizika.ru/wp-content/uploads/2017/08/Shema-k-resheniyu-zadachi-21.jpg""><span itemprop=""image"" itemscope="""" itemtype=""https://schema.org/ImageObject""><img alt=""Схема к решению задачи"" class=""alignright wp-image-8668 size-medium"" height=""217"" itemprop=""url image"" sizes=""(max-width: 300px) 100vw, 300px"" src=""http://easyfizika.ru/wp-content/uploads/2017/08/Shema-k-resheniyu-zadachi-21-300x217.jpg"" srcset=""http://easyfizika.ru/wp-content/uploads/2017/08/Shema-k-resheniyu-zadachi-21-300x217.jpg 300w, http://easyfizika.ru/wp-content/uploads/2017/08/Shema-k-resheniyu-zadachi-21-150x108.jpg 150w, http://easyfizika.ru/wp-content/uploads/2017/08/Shema-k-resheniyu-zadachi-21.jpg 865w"" width=""300""/><meta content=""300"" itemprop=""width""/><meta content=""217"" itemprop=""height""/></span></a>Пылинка находится в равновесии под действием двух сил: силы тяжести \(mg\) и силы \(F_{эл}\), действующей на пылинку со стороны электрического поля (смотрите схему). Так как последняя должна быть направлена наверх (точнее против силы тяжести), то и вектор напряженности поля \(\overrightarrow E\) также будет направлен наверх, поскольку заряд пылинки \(q\) – положительный.</p>, <p>Запишем первый закон Ньютона в проекции на ось \(y\):</p>, <p>\[mg = {F_{эл}}\]</p>, <p>Силу \(F_{эл}\) можно найти по следующей формуле:</p>, <p>\[{F_{эл}} = Eq\]</p>, <p>Тогда:</p>, <p>\[mg = Eq\]</p>, <p>Откуда искомая масса пылинки \(m\) равна:</p>, <p>\[m = \frac{{Eq}}{g}\]</p>, <p>Произведём расчёт численного ответа:</p>, <p>\[m = \frac{{50 \cdot 20 \cdot {{10}^{ – 9}}}}{{10}} = {10^{ – 7}}\;кг = 0,1\;мг\]</p>]"
70;[<p>Свинцовый шарик радиусом 0,5 см помещён в глицерин. Определить заряд шарика, если в однородном электрическом поле шарик оказался взвешенным в глицерине. Электростатическое поле направлено вертикально вверх и его напряженность 4 кВ/см.</p>, <p><em>Задача №6.2.40 из «Сборника задач для подготовки к вступительным экзаменам по физике УГНТУ»</em></p>];"[<p>\(r=0,5\) см, \(E=4\) кВ/см, \(q-?\)</p>, <p><a class=""fancybox"" href=""http://easyfizika.ru/wp-content/uploads/2017/08/Shema-k-resheniyu-zadachi-22.jpg""><span itemprop=""image"" itemscope="""" itemtype=""https://schema.org/ImageObject""><img alt=""Схема к решению задачи"" class=""alignright wp-image-8675 size-medium"" height=""199"" itemprop=""url image"" sizes=""(max-width: 300px) 100vw, 300px"" src=""http://easyfizika.ru/wp-content/uploads/2017/08/Shema-k-resheniyu-zadachi-22-300x199.jpg"" srcset=""http://easyfizika.ru/wp-content/uploads/2017/08/Shema-k-resheniyu-zadachi-22-300x199.jpg 300w, http://easyfizika.ru/wp-content/uploads/2017/08/Shema-k-resheniyu-zadachi-22-150x100.jpg 150w, http://easyfizika.ru/wp-content/uploads/2017/08/Shema-k-resheniyu-zadachi-22-1024x680.jpg 1024w, http://easyfizika.ru/wp-content/uploads/2017/08/Shema-k-resheniyu-zadachi-22.jpg 1544w"" width=""300""/><meta content=""300"" itemprop=""width""/><meta content=""199"" itemprop=""height""/></span></a>Шарик оказался взвешенным в глицерине (то есть плавающим) под действием трёх сил: силы тяжести \(mg\), силы Архимеда \(F_А\) и электрической силы \(F_{эл}\). Запишем первый закон Ньютона в проекции на ось \(y\):</p>, <p>\[mg = {F_{эл}} + {F_А}\;\;\;\;(1)\]</p>, <p>Массу свинцового шарика \(m\) определим по формуле (плотность свинца \(\rho_{св}=11300\) кг/м<sup>3</sup>):</p>, <p>\[m = \rho_{св} V\]</p>, <p>Из математики известно, что объем шара \(m\) можно найти по формуле:</p>, <p>\[V = \frac{4}{3}\pi {r^3}\;\;\;\;(2)\]</p>, <p>Тогда имеем:</p>, <p>\[m = \frac{4}{3}\pi {r^3}\rho_{св} \;\;\;\;(3)\]</p>, <p>Силу \(F_{эл}\) можно определить через величину напряженности поля \(E\) и заряд шарика \(q\):</p>, <p>\[{F_{эл}} = Eq\;\;\;\;(4)\]</p>, <p>Силу Архимеда (выталкивающую силу глицерина) \(F_А\) можно найти по известной формуле (плотность глицерина \(\rho_{гл}=1200\) кг/м<sup>3</sup>):</p>, <p>\[{F_А} = {\rho _{гл}}gV\]</p>, <p>Учитывая формулу (2), имеем:</p>, <p>\[{F_А} = \frac{4}{3}\pi {r^3}{\rho _{гл}}g\;\;\;\;(5)\]</p>, <p>Подставим выражения (3), (4) и (5) в равенство (1):</p>, <p>\[\frac{4}{3}\pi {r^3}{\rho _{св}}g = Eq + \frac{4}{3}\pi {r^3}{\rho _{гл}}g\]</p>, <p>\[Eq = \frac{4}{3}\pi {r^3}\left( {{\rho _{св}} – {\rho _{гл}}} \right)g\]</p>, <p>В итоге получим такую окончательную формулу:</p>, <p>\[q = \frac{{4\pi {r^3}\left( {{\rho _{св}} – {\rho _{гл}}} \right)g}}{{3E}}\]</p>, <p>Численное значение заряда свинцового шарика \(q\) равно:</p>, <p>\[q = \frac{{4 \cdot 3,14 \cdot {{\left( {0,5 \cdot {{10}^{ – 2}}} \right)}^3} \cdot \left( {11300 – 1200} \right) \cdot 10}}{{3 \cdot 4 \cdot {{10}^5}}} = 0,132 \cdot {10^{ – 6}}\;Кл = 0,132\;мкКл\]</p>]"
71;[<p>Капля массой 10<sup>-10</sup> г, на которой находится заряд, равный 10 зарядам электрона, поднимается вертикально вверх с ускорением 2 м/с<sup>2</sup> между пластинами горизонтально расположенного конденсатора. Определить поверхностную плотность заряда на пластинах конденсатора. Сопротивлением воздуха пренебречь.</p>, <p><em>Задача №6.2.41 из «Сборника задач для подготовки к вступительным экзаменам по физике УГНТУ»</em></p>];"[<p>\(m=10^{-10}\) г, \(q=10e\), \(a=2\) м/с<sup>2</sup>, \(\sigma-?\)</p>, <p><a class=""fancybox"" href=""http://easyfizika.ru/wp-content/uploads/2017/08/Shema-k-resheniyu-zadachi-23.jpg""><span itemprop=""image"" itemscope="""" itemtype=""https://schema.org/ImageObject""><img alt=""Схема к решению задачи"" class=""alignright wp-image-8692 size-medium"" height=""231"" itemprop=""url image"" sizes=""(max-width: 300px) 100vw, 300px"" src=""http://easyfizika.ru/wp-content/uploads/2017/08/Shema-k-resheniyu-zadachi-23-300x231.jpg"" srcset=""http://easyfizika.ru/wp-content/uploads/2017/08/Shema-k-resheniyu-zadachi-23-300x231.jpg 300w, http://easyfizika.ru/wp-content/uploads/2017/08/Shema-k-resheniyu-zadachi-23-150x116.jpg 150w, http://easyfizika.ru/wp-content/uploads/2017/08/Shema-k-resheniyu-zadachi-23.jpg 811w"" width=""300""/><meta content=""300"" itemprop=""width""/><meta content=""231"" itemprop=""height""/></span></a>Капля движется с ускорением \(a\) под действием двух сил: силы \(F_{эл}\), действующей на каплю со стороны электрического поля конденсатора, и силы тяжести \(mg\) (смотрите схему). Запишем второй закон Ньютона в проекции на ось \(y\):</p>, <p>\[{F_{эл}} – mg = ma\;\;\;\;(1)\]</p>, <p>Силу \(F_{эл}\), действующую на каплю со стороны электрического поля конденсатора, найдём по такой формуле:</p>, <p>\[{F_{эл}} = Eq\]</p>, <p>Напряженность электрического поля воздушного конденсатора \(E\) определяют следующим образом:</p>, <p>\[E = \frac{\sigma }{{{\varepsilon _0}}}\]</p>, <p>Тогда:</p>, <p>\[{F_{эл}} = \frac{{\sigma q}}{{{\varepsilon _0}}}\]</p>, <p>Полученное выражение подставим в формулу (1):</p>, <p>\[\frac{{\sigma q}}{{{\varepsilon _0}}} – mg = ma\]</p>, <p>\[\frac{{\sigma q}}{{{\varepsilon _0}}} = m\left( {a + g} \right)\]</p>, <p>\[\sigma = \frac{{m\left( {a + g} \right){\varepsilon _0}}}{q}\]</p>, <p>Учитывая, что по условию заряд капли равен 10 зарядам электрона (\(q=10e\), \(e=1,6 \cdot 10^{-19}\) Кл – модуль заряда электрона), окончательно получим:</p>, <p>\[\sigma = \frac{{m\left( {a + g} \right){\varepsilon _0}}}{{10e}}\]</p>, <p>Посчитаем ответ задачи (не забываем переводить в систему СИ значения величин):</p>, <p>\[\sigma = \frac{{{{10}^{ – 13}} \cdot \left( {2 + 10} \right) \cdot 8,85 \cdot {{10}^{ – 12}}}}{{10 \cdot 1,6 \cdot {{10}^{ – 19}}}} = 6,64 \cdot {10^{ – 6}}\;Кл/м^2  = 6,64\;мкКл/м^2\]</p>]"
72;[<p>Капля массой 10<sup>-13</sup> кг поднимается вертикально вверх с ускорением 2,2 м/с<sup>2</sup> между пластинами горизонтального плоского конденсатора. Найти заряд капли, если поверхностная плотность заряда на пластина равна 6,6 мкКл/м<sup>2</sup>.</p>, <p><em>Задача №6.2.42 из «Сборника задач для подготовки к вступительным экзаменам по физике УГНТУ»</em></p>];"[<p>\(m=10^{-13}\) кг, \(a=2,2\) м/с<sup>2</sup>, \(\sigma=6,6\) мкКл/м<sup>2</sup>, \(q-?\)</p>, <p><a class=""fancybox"" href=""http://easyfizika.ru/wp-content/uploads/2017/08/Shema-k-resheniyu-zadachi-24.jpg""><span itemprop=""image"" itemscope="""" itemtype=""https://schema.org/ImageObject""><img alt=""Схема к решению задачи"" class=""alignright wp-image-8687 size-medium"" height=""248"" itemprop=""url image"" sizes=""(max-width: 300px) 100vw, 300px"" src=""http://easyfizika.ru/wp-content/uploads/2017/08/Shema-k-resheniyu-zadachi-24-300x248.jpg"" srcset=""http://easyfizika.ru/wp-content/uploads/2017/08/Shema-k-resheniyu-zadachi-24-300x248.jpg 300w, http://easyfizika.ru/wp-content/uploads/2017/08/Shema-k-resheniyu-zadachi-24-150x124.jpg 150w, http://easyfizika.ru/wp-content/uploads/2017/08/Shema-k-resheniyu-zadachi-24.jpg 756w"" width=""300""/><meta content=""300"" itemprop=""width""/><meta content=""248"" itemprop=""height""/></span></a>На каплю действуют сила тяжести \(mg\) и сила взаимодействия со стороны электрического поля конденсатора \(F_{эл}\). Под действием указанных двух сил капля движется равноускоренно вверх, поэтому запишем второй закон Ньютона в проекции на ось \(y\):</p>, <p>\[{F_{эл}} – mg = ma\;\;\;\;(1)\]</p>, <p>Силу \(F_{эл}\), действующую на каплю с искомым зарядом \(q\) со стороны электрического поля конденсатора, можно определить по такой известной формуле:</p>, <p>\[{F_{эл}} = Eq\]</p>, <p>Напряженность электрического поля воздушного конденсатора \(E\) равна:</p>, <p>\[E = \frac{\sigma }{{{\varepsilon _0}}}\]</p>, <p>Здесь \(\varepsilon _0\) – электрическая постоянная, равная 8,85·10<sup>-12</sup> Ф/м. Тогда:</p>, <p>\[{F_{эл}} = \frac{{\sigma q}}{{{\varepsilon _0}}}\]</p>, <p>В итоге формула (1) примет такой вид:</p>, <p>\[\frac{{\sigma q}}{{{\varepsilon _0}}} – mg = ma\]</p>, <p>\[\frac{{\sigma q}}{{{\varepsilon _0}}} = m\left( {a + g} \right)\]</p>, <p>\[q = \frac{{m\left( {a + g} \right){\varepsilon _0}}}{\sigma }\]</p>, <p>Задача решена в общем виде, теперь произведём расчёт численного ответа (не забываем переводить значения величин в систему СИ):</p>, <p>\[q = \frac{{{{10}^{ – 13}} \cdot \left( {2,2 + 9,8} \right) \cdot 8,85 \cdot {{10}^{ – 12}}}}{{6,6 \cdot {{10}^{ – 6}}}} = 160 \cdot {10^{ – 20}}\;Кл\]</p>, <p>Заряд капли положителен и равен 10 элементарным зарядам.</p>]"
