;question;answer
120;[<p>Электрон вылетает из точки, потенциал которой 600 В, со скоростью 12 Мм/с в направлении силовых линий поля. Определить потенциал точки, дойдя до которой, электрон остановится.</p>, <p><em>Задача №6.3.32 из «Сборника задач для подготовки к вступительным экзаменам по физике УГНТУ»</em></p>];"[<p>\(\varphi_1=600\) В, \(\upsilon_0=12\) Мм/с, \(\upsilon=0\) м/с, \(\varphi_2-?\)</p>, <p><a class=""fancybox"" href=""http://easyfizika.ru/wp-content/uploads/2017/10/Shema-k-resheniyu-zadachi-9.jpg""><span itemprop=""image"" itemscope="""" itemtype=""https://schema.org/ImageObject""><img alt=""Схема к решению задачи"" class=""alignright wp-image-9758 size-medium"" height=""169"" itemprop=""url image"" sizes=""(max-width: 300px) 100vw, 300px"" src=""http://easyfizika.ru/wp-content/uploads/2017/10/Shema-k-resheniyu-zadachi-9-300x169.jpg"" srcset=""http://easyfizika.ru/wp-content/uploads/2017/10/Shema-k-resheniyu-zadachi-9-300x169.jpg 300w, http://easyfizika.ru/wp-content/uploads/2017/10/Shema-k-resheniyu-zadachi-9-150x84.jpg 150w, http://easyfizika.ru/wp-content/uploads/2017/10/Shema-k-resheniyu-zadachi-9.jpg 858w"" width=""300""/><meta content=""300"" itemprop=""width""/><meta content=""169"" itemprop=""height""/></span></a>Если электрон движется в направлении силовых линий поля, то есть по направлению вектора напряженности этого поля, значит он будет тормозиться, так как вектор силы (а значит и вектор ускорения) для электрона направлены противоположно вектору напряженности (поскольку электрон имеет отрицательный заряд). Это всё прекрасно показано на схеме к решению задачи.</p>, <p>Также понятно, что \({\varphi_1} &gt; {\varphi_2}\), так как вектор напряженности направлен в сторону убывания потенциала.</p>, <p>Очевидно, что поле совершит отрицательную работу (так как вектор силы противонаправлен вектору перемещения), эту работу можно найти по формуле:</p>, <p>\[A = – \Delta \varphi e\]</p>, <p>Здесь \(\Delta \varphi\) – разность потенциалов, равная \(\Delta \varphi = {\varphi _1} – {\varphi _2}\), \(e\) – модуль заряда электрона (так называемый элементарный заряд), равный 1,6·10<sup>-19</sup> Кл. Знаком “минус” мы учли то, что заряд электрона отрицательный. Тогда:</p>, <p>\[A = – \left( {{\varphi _1} – {\varphi _2}} \right)e\]</p>, <p>\[A = \left( {{\varphi _2} – {\varphi _1}} \right)e\;\;\;\;(1)\]</p>, <p>Также работу поля можно найти как изменение кинетической энергии электрона:</p>, <p>\[A = \frac{{{m_e}{\upsilon ^2}}}{2} – \frac{{{m_e}\upsilon _0^2}}{2}\]</p>, <p>Здесь \(m_e\) – масса электрона, равная 9,1·10<sup>-31</sup> кг. Так как \(\upsilon=0\), то:</p>, <p>\[A = – \frac{{{m_e}\upsilon _0^2}}{2}\;\;\;\;(2)\]</p>, <p>Приравняем (1) и (2), получим:</p>, <p>\[\left( {{\varphi _2} – {\varphi _1}} \right)e = – \frac{{{m_e}\upsilon _0^2}}{2}\]</p>, <p>\[{\varphi _2} = {\varphi _1} – \frac{{{m_e}\upsilon _0^2}}{{2e}}\]</p>, <p>Поздравляю, мы получим окончательное решение задачи. Теперь посчитаем численный ответ:</p>, <p>\[{\varphi _2} = 600 – \frac{{9,1 \cdot {{10}^{ – 31}} \cdot {{\left( {12 \cdot {{10}^6}} \right)}^2}}}{{2 \cdot 1,6 \cdot {{10}^{ – 19}}}} = 190,5\;В\]</p>]"
121;[<p>Электрон с начальной скоростью 2000 км/с, двигаясь в поле плоского конденсатора вдоль линий напряженности, полностью теряет скорость на пути 3 см. Какова разность потенциалов между обкладками, если расстояние между ними 5 см?</p>, <p><em>Задача №6.3.33 из «Сборника задач для подготовки к вступительным экзаменам по физике УГНТУ»</em></p>];"[<p>\(\upsilon_0=2000\) км/с, \(\upsilon=0\) м/с, \(S=3\) см, \(d=5\) см, \(\Delta \varphi – ?\)</p>, <p><a class=""fancybox"" href=""http://easyfizika.ru/wp-content/uploads/2017/10/Shema-k-resheniyu-zadachi-10.jpg""><span itemprop=""image"" itemscope="""" itemtype=""https://schema.org/ImageObject""><img alt=""Схема к решению задачи"" class=""alignright wp-image-9766 size-medium"" height=""173"" itemprop=""url image"" sizes=""(max-width: 300px) 100vw, 300px"" src=""http://easyfizika.ru/wp-content/uploads/2017/10/Shema-k-resheniyu-zadachi-10-300x173.jpg"" srcset=""http://easyfizika.ru/wp-content/uploads/2017/10/Shema-k-resheniyu-zadachi-10-300x173.jpg 300w, http://easyfizika.ru/wp-content/uploads/2017/10/Shema-k-resheniyu-zadachi-10-150x86.jpg 150w, http://easyfizika.ru/wp-content/uploads/2017/10/Shema-k-resheniyu-zadachi-10-1024x589.jpg 1024w, http://easyfizika.ru/wp-content/uploads/2017/10/Shema-k-resheniyu-zadachi-10.jpg 1186w"" width=""300""/><meta content=""300"" itemprop=""width""/><meta content=""173"" itemprop=""height""/></span></a>Пусть обкладки конденсатора заряжены так, как показано на схеме. Тогда чтобы электрон постепенно замедлялся при движении в конденсаторе, напряженность поля внутри конденсатора должна быть направлена слева направо, поскольку в этом случае действующая на него сила (и ускорение) будут направлены справа налево, т.е против скорости электрона.</p>, <p>Поле конденсатора совершит отрицательную работу, величину которой можно найти по формуле:</p>, <p>\[A = – FS\]</p>, <p>Электрическую силу \(F\) (точнее, её модуль) легко найти из напряженности поля конденсатора \(E\) и модуля заряда электрона \(e\) (он равен 1,6·10<sup>-19</sup> Кл) следующим образом:</p>, <p>\[F = Ee\]</p>, <p>Тогда:</p>, <p>\[A = – EeS \;\;\;\;(1)\]</p>, <p>Также работу поля можно определить как изменение кинетической энергии электрона:</p>, <p>\[A = \frac{{{m_e}{\upsilon ^2}}}{2} – \frac{{{m_e}\upsilon _0^2}}{2}\]</p>, <p>Поскольку в условии сказано, что электрон в конце полностью потеряет скорость, т.е. \(\upsilon=0\), имеем:</p>, <p>\[A = – \frac{{{m_e}\upsilon _0^2}}{2}\;\;\;\;(2)\]</p>, <p>Теперь приравняем (1) и (2) и из полученного равенства выразим напряженность поля:</p>, <p>\[ – EeS = – \frac{{{m_e}\upsilon _0^2}}{2}\]</p>, <p>\[E = \frac{{{m_e}\upsilon _0^2}}{{2eS}}\;\;\;\;(3)\]</p>, <p>Разность потенциалов между обкладками конденсатора \(\Delta \varphi\) и напряженность поля конденсатора связаны друг с другом соотношением:</p>, <p>\[E = \frac{{\Delta \varphi }}{d}\]</p>, <p>Значит:</p>, <p>\[\Delta \varphi = Ed\]</p>, <p>Учитывая (3), получим окончательную формулу для нахождения ответа этой задачи:</p>, <p>\[\Delta \varphi = \frac{{{m_e}\upsilon _0^2d}}{{2eS}}\]</p>, <p>Считаем ответ:</p>, <p>\[\Delta \varphi = \frac{{9,1 \cdot {{10}^{ – 31}} \cdot {{\left( {2000 \cdot {{10}^3}} \right)}^2} \cdot 0,05}}{{2 \cdot 1,6 \cdot {{10}^{ – 19}} \cdot 0,03}} = 18,96\;В \approx 19\;В\]</p>]"
122;[<p>В поле неподвижного точечного заряда 1 мкКл по направлению к нему движется положительный ион массой 10<sup>-26</sup> кг и зарядом 1,6·10<sup>-19</sup> Кл. Когда скорость иона составляет 10<sup>5</sup> м/с, его кинетическая и потенциальная энергия равны. На какое минимальное расстояние ион приблизится к заряду?</p>, <p><em>Задача №6.3.34 из «Сборника задач для подготовки к вступительным экзаменам по физике УГНТУ»</em></p>];"[<p>\(Q=1\) мкКл, \(m=10^{-26}\) кг, \(q=1,6 \cdot 10^{-19}\) Кл, \(\upsilon=10^{5}\) м/с, \(W_{к1}=W_{п1}\), \(d-?\)</p>, <p><a class=""fancybox"" href=""http://easyfizika.ru/wp-content/uploads/2017/10/Shema-k-resheniyu-zadachi-11.jpg""><span itemprop=""image"" itemscope="""" itemtype=""https://schema.org/ImageObject""><img alt=""Схема к решению задачи"" class=""alignright wp-image-9772 size-medium"" height=""165"" itemprop=""url image"" sizes=""(max-width: 300px) 100vw, 300px"" src=""http://easyfizika.ru/wp-content/uploads/2017/10/Shema-k-resheniyu-zadachi-11-300x165.jpg"" srcset=""http://easyfizika.ru/wp-content/uploads/2017/10/Shema-k-resheniyu-zadachi-11-300x165.jpg 300w, http://easyfizika.ru/wp-content/uploads/2017/10/Shema-k-resheniyu-zadachi-11-150x83.jpg 150w, http://easyfizika.ru/wp-content/uploads/2017/10/Shema-k-resheniyu-zadachi-11-1024x564.jpg 1024w, http://easyfizika.ru/wp-content/uploads/2017/10/Shema-k-resheniyu-zadachi-11.jpg 1177w"" width=""300""/><meta content=""300"" itemprop=""width""/><meta content=""165"" itemprop=""height""/></span></a>Пусть в точке 1 кинетическая и потенциальная энергия иона равны, а в точке 2 ион будет находиться на минимальном расстоянии от точечного заряда. Запишем закон сохранения энергии для системы “ион – точечный заряд”, когда ион находится в точках 1 и 2:</p>, <p>\[{W_{к1}} + {W_{п1}} = {W_{к2}} + {W_{п2}}\]</p>, <p>Когда ион максимально близится к точечному закрепленному заряду, то есть будет находиться в точке 2, его скорость (а значит и кинетическая энергия \(W_{к2}\)) будут равны нулю, поэтому:</p>, <p>\[{W_{к1}} + {W_{п1}} = {W_{п2}}\]</p>, <p>Так как по условию \(W_{к1}=W_{п1}\), то:</p>, <p>\[2{W_{п1}} = {W_{п2}}\]</p>, <p>Использую рисунок, распишем указанные потенциальные энергии взаимодействия зарядов:</p>, <p>\[\frac{{2kQq}}{l} = \frac{{kQq}}{d}\]</p>, <p>В этой формуле \(k\) – коэффициент пропорциональности, равный 9·10<sup>9</sup> Н·м<sup>2</sup>/Кл<sup>2</sup>.</p>, <p>Откуда получим:</p>, <p>\[d = \frac{l}{2} \;\;\;\;(1)\]</p>, <p>Теперь распишем уже упомянутое (данное в условии) равенство \(W_{к1}=W_{п1}\):</p>, <p>\[\frac{{m{\upsilon ^2}}}{2} = \frac{{kQq}}{l}\]</p>, <p>Выразим из равенства \(l\):</p>, <p>\[l = \frac{{2kQq}}{{m{\upsilon ^2}}}\]</p>, <p>Полученное подставим в (1):</p>, <p>\[d = \frac{{kQq}}{{m{\upsilon ^2}}}\]</p>, <p>Задача решена, посчитаем ответ:</p>, <p>\[d = \frac{{9 \cdot {{10}^9} \cdot 1 \cdot {{10}^{ – 6}} \cdot 1,6 \cdot {{10}^{ – 19}}}}{{{{10}^{ – 26}} \cdot {{\left( {{{10}^5}} \right)}^2}}} = 14,4\;м = 1440\;см\]</p>]"
123;[<p>Электрическое поле в вакууме образовано точечным зарядом 1,5 нКл. На каком расстоянии друг от друга расположены две эквипотенциальные поверхности, потенциалы которых равны 45 и 30 В, соответственно?</p>, <p><em>Задача №6.3.35 из «Сборника задач для подготовки к вступительным экзаменам по физике УГНТУ»</em></p>];"[<p>\(q=1,5\) нКл, \(\varphi_1=45\) В, \(\varphi_2=30\) В, \(l-?\)</p>, <p><a class=""fancybox"" href=""http://easyfizika.ru/wp-content/uploads/2017/10/Shema-k-resheniyu-zadachi-12.jpg""><span itemprop=""image"" itemscope="""" itemtype=""https://schema.org/ImageObject""><img alt=""Схема к решению задачи"" class=""alignright wp-image-9781 size-medium"" height=""300"" itemprop=""url image"" sizes=""(max-width: 253px) 100vw, 253px"" src=""http://easyfizika.ru/wp-content/uploads/2017/10/Shema-k-resheniyu-zadachi-12-253x300.jpg"" srcset=""http://easyfizika.ru/wp-content/uploads/2017/10/Shema-k-resheniyu-zadachi-12-253x300.jpg 253w, http://easyfizika.ru/wp-content/uploads/2017/10/Shema-k-resheniyu-zadachi-12-127x150.jpg 127w, http://easyfizika.ru/wp-content/uploads/2017/10/Shema-k-resheniyu-zadachi-12.jpg 801w"" width=""253""/><meta content=""253"" itemprop=""width""/><meta content=""300"" itemprop=""height""/></span></a>Эквипотенциальными поверхностями (т.е. поверхностями, в каждой точке которых потенциал одинаковый) точечного заряда являются сферы. На схеме эти сферы показаны в виде окружностей, поскольку проекция сферы на плоскость есть окружность. Запишем формулы для определения потенциалов \(\varphi_1\) и \(\varphi_2\):</p>, <p>\[\left\{ \begin{gathered}<br/> {\varphi _1} = \frac{{kq}}{{{r_1}}} \hfill \\<br/> {\varphi _2} = \frac{{kq}}{{{r_2}}} \hfill \\<br/> \end{gathered} \right.\]</p>, <p>Здесь \(k\) – коэффициент пропорциональности (из закона Кулона), равный 9·10<sup>9</sup> Н·м<sup>2</sup>/Кл<sup>2</sup>.</p>, <p>Откуда радиусы соответствующих сфер равны:</p>, <p>\[\left\{ \begin{gathered}<br/> {r_1} = \frac{{kq}}{{{\varphi _1}}} \hfill \\<br/> {r_2} = \frac{{kq}}{{{\varphi _2}}} \hfill \\<br/> \end{gathered} \right.\]</p>, <p>Так как \({r_2} &gt; {r_1}\), что хорошо видно на схеме, то искомое расстояние \(l\) будем искать по формуле:</p>, <p>\[l = {r_2} – {r_1}\]</p>, <p>Учитывая формулы, приведённые в последней системе, получим:</p>, <p>\[l = \frac{{kq}}{{{\varphi _2}}} – \frac{{kq}}{{{\varphi _1}}}\]</p>, <p>\[l = \frac{{kq\left( {{\varphi _1} – {\varphi _2}} \right)}}{{{\varphi _1}{\varphi _2}}}\]</p>, <p>Задача решена в общем виде. Численно расстояние \(l\) равно:</p>, <p>\[l = \frac{{9 \cdot {{10}^9} \cdot 1,5 \cdot {{10}^{ – 9}} \cdot \left( {45 – 30} \right)}}{{45 \cdot 30}} = 0,15\;м\]</p>]"
124;[<p>Электрическое поле в глицерине образовано точечным зарядом 20 нКл. На каком расстоянии расположены друг от друга две эквипотенциальные поверхности с потенциалами 50 и 20 В?</p>, <p><em>Задача №6.3.36 из «Сборника задач для подготовки к вступительным экзаменам по физике УГНТУ»</em></p>];"[<p>\(q=20\) нКл, \(\varphi_1=50\) В, \(\varphi_2=20\) В, \(l-?\)</p>, <p><a class=""fancybox"" href=""http://easyfizika.ru/wp-content/uploads/2017/10/Shema-k-resheniyu-zadachi-13.jpg""><span itemprop=""image"" itemscope="""" itemtype=""https://schema.org/ImageObject""><img alt=""Схема к решению задачи"" class=""alignright wp-image-9787 size-medium"" height=""300"" itemprop=""url image"" sizes=""(max-width: 253px) 100vw, 253px"" src=""http://easyfizika.ru/wp-content/uploads/2017/10/Shema-k-resheniyu-zadachi-13-253x300.jpg"" srcset=""http://easyfizika.ru/wp-content/uploads/2017/10/Shema-k-resheniyu-zadachi-13-253x300.jpg 253w, http://easyfizika.ru/wp-content/uploads/2017/10/Shema-k-resheniyu-zadachi-13-127x150.jpg 127w, http://easyfizika.ru/wp-content/uploads/2017/10/Shema-k-resheniyu-zadachi-13.jpg 801w"" width=""253""/><meta content=""253"" itemprop=""width""/><meta content=""300"" itemprop=""height""/></span></a>Эквипотенциальными поверхностями точечного заряда являются сферы, которые на плоскость проецируются в виде сфер (смотрите схему). Запишем формулы для определения потенциалов \(\varphi_1\) и \(\varphi_2\), причём не забудем тот факт, что точечный заряд находится в глицерине (диэлектрическая проницаемость \(\varepsilon\) которого равна 39):</p>, <p>\[\left\{ \begin{gathered}<br/> {\varphi _1} = \frac{{kq}}{{\varepsilon {r_1}}} \hfill \\<br/> {\varphi _2} = \frac{{kq}}{{\varepsilon {r_2}}} \hfill \\<br/> \end{gathered} \right.\]</p>, <p>Коэффициент пропорциональности \(k\) равен 9·10<sup>9</sup> Н·м<sup>2</sup>/Кл<sup>2</sup>. Выразим из этих формул радиусы сфер \(r_1\) и \(r_2\):</p>, <p>\[\left\{ \begin{gathered}<br/> {r_1} = \frac{{kq}}{{\varepsilon {\varphi _1}}} \hfill \\<br/> {r_2} = \frac{{kq}}{{\varepsilon {\varphi _2}}} \hfill \\<br/> \end{gathered} \right.\]</p>, <p>Понятно, что расстояние между эквипотенциальными поверхностями \(l\) нужно искать по такой простой формуле:</p>, <p>\[l = {r_2} – {r_1}\]</p>, <p>Тогда:</p>, <p>\[l = \frac{{kq}}{{\varepsilon {\varphi _2}}} – \frac{{kq}}{{\varepsilon {\varphi _1}}}\]</p>, <p>\[l = \frac{{kq\left( {{\varphi _1} – {\varphi _2}} \right)}}{{\varepsilon {\varphi _1}{\varphi _2}}}\]</p>, <p>Задача решена, посчитаем численный ответ:</p>, <p>\[l = \frac{{9 \cdot {{10}^9} \cdot 20 \cdot {{10}^{ – 9}} \cdot \left( {50 – 20} \right)}}{{39 \cdot 50 \cdot 20}} = 0,14\;м = 14\;см\]</p>]"
125;[<p>Между двумя горизонтально расположенными пластинами, заряженными до 10 кВ, удерживается в равновесии пылинка массой 2·10<sup>-10</sup> кг. Определить заряд пылинки, если расстояние между пластинами 5 см?</p>, <p><em>Задача №6.3.37 из «Сборника задач для подготовки к вступительным экзаменам по физике УГНТУ»</em></p>];"[<p>\(\Delta \varphi=10\) кВ, \(m=2 \cdot 10^{-10}\) кг, \(d=5\) см, \(q-?\)</p>, <p><a class=""fancybox"" href=""http://easyfizika.ru/wp-content/uploads/2017/10/Shema-k-resheniyu-zadachi-14.jpg""><span itemprop=""image"" itemscope="""" itemtype=""https://schema.org/ImageObject""><img alt=""Схема к решению задачи"" class=""alignright wp-image-9795 size-medium"" height=""151"" itemprop=""url image"" sizes=""(max-width: 300px) 100vw, 300px"" src=""http://easyfizika.ru/wp-content/uploads/2017/10/Shema-k-resheniyu-zadachi-14-300x151.jpg"" srcset=""http://easyfizika.ru/wp-content/uploads/2017/10/Shema-k-resheniyu-zadachi-14-300x151.jpg 300w, http://easyfizika.ru/wp-content/uploads/2017/10/Shema-k-resheniyu-zadachi-14-150x75.jpg 150w, http://easyfizika.ru/wp-content/uploads/2017/10/Shema-k-resheniyu-zadachi-14.jpg 1010w"" width=""300""/><meta content=""300"" itemprop=""width""/><meta content=""151"" itemprop=""height""/></span></a>На пылинку действуют две силы: сила тяжести \(mg\) и электрическая сила \(F_{эл}\). Понятно, что если пылинка находится в равновесии, то эти силы должны быть противонаправлены. Пусть нижняя пластина заряжена положительно, а верхняя – отрицательно. Тогда напряженность поля пластин направлена снизу вверх, как показано на схеме. В таком случае пылинка должна иметь положительный заряд, чтобы сила \(F_{эл}\) была также направлена наверх. Если заряды пластин поменять, то пылинка уже должна быть заряжена отрицательно (можете это проверить, выполнив аналогичные рассуждения).</p>, <p>Запишем первый закон Ньютона в проекции на ось \(y\):</p>, <p>\[mg – {F_{эл}} = 0\]</p>, <p>\[mg = {F_{эл}}\;\;\;\;(1)\]</p>, <p>Силу \(F_{эл}\) можно найти через напряженность поля \(E\) и модуль заряда пылинки \(q\):</p>, <p>\[{F_{эл}} = Eq\;\;\;\;(2)\]</p>, <p>А вот напряженность поля \(E\) связана с разностью потенциалов \(\Delta \varphi\) и расстоянием между пластинами \(d\) по такой формуле:</p>, <p>\[E = \frac{{\Delta \varphi }}{d}\;\;\;\;(3)\]</p>, <p>Подставим (3) в (2), а полученное – в (1):</p>, <p>\[mg = \frac{{\Delta \varphi q}}{d}\]</p>, <p>Откуда искомый заряд пылинки \(q\) равен:</p>, <p>\[q = \frac{{mgd}}{{\Delta \varphi }}\]</p>, <p>Произведём расчёт ответа:</p>, <p>\[q = \frac{{2 \cdot {{10}^{ – 10}} \cdot 10 \cdot 0,05}}{{10 \cdot {{10}^3}}} = {10^{ – 14}}\;Кл\]</p>]"
