;question;answer
157;[<p>Проводники, заряженные одинаковым зарядом, имеют потенциалы 40 и 60 В. Каким будет потенциал этих проводников, если их соединить проволокой?</p>, <p><em>Задача №6.4.5 из «Сборника задач для подготовки к вступительным экзаменам по физике УГНТУ»</em></p>];"[<p>\(\varphi_1=40\) В, \(\varphi_2=60\) В, \(\varphi-?\)</p>, <p>Мы не можем сразу сказать величину потенциалов проводников после соединения их проволокой, но точно можем утверждать, то они будут одинаковы. Пусть начальный заряд на каждом проводнике равен \(q\), электроемкости первого и второго проводника равны соответственно \(C_1\) и \(C_2\), тогда мы можем записать две такие формулы для определения потенциалов \(\varphi_1\) и \(\varphi_2\):</p>, <p>\[\left\{ \begin{gathered}<br/> {\varphi _1} = \frac{q}{{{C_1}}} \hfill \\<br/> {\varphi _2} = \frac{q}{{{C_2}}} \hfill \\<br/> \end{gathered} \right.\]</p>, <p>Из этих формул выразим электроемкости \(C_1\) и \(C_2\), они нам понадобятся в ходе дальнейшего решения:</p>, <p>\[\left\{ \begin{gathered}<br/> {C_1} = \frac{q}{{{\varphi _1}}} \hfill \\<br/> {C_2} = \frac{q}{{{\varphi _2}}} \hfill \\<br/> \end{gathered} \right.\]</p>, <p>Допустим, что при соединении проводников на первый из них перетечет заряд \(\Delta q\), тогда очевидно, что на втором проводнике заряд станет меньше на такую же величину. Как мы уже сказали, потенциал проводников будет одинаковым, поэтому будет правильно записать:</p>, <p>\[\left\{ \begin{gathered}<br/> \varphi = \frac{{q + \Delta q}}{{{C_1}}} \hfill \\<br/> \varphi = \frac{{q – \Delta q}}{{{C_2}}} \hfill \\<br/> \end{gathered} \right.\]</p>, <p>То есть имеет место равенство:</p>, <p>\[\frac{{q + \Delta q}}{{{C_1}}} = \frac{{q – \Delta q}}{{{C_2}}}\]</p>, <p>Подставим в это равенство ранее полученные выражения для электроемкостей:</p>, <p>\[\frac{{\left( {q + \Delta q} \right){\varphi _1}}}{q} = \frac{{\left( {q – \Delta q} \right){\varphi _2}}}{q}\]</p>, <p>\[\left( {1 + \frac{{\Delta q}}{q}} \right){\varphi _1} = \left( {1 – \frac{{\Delta q}}{q}} \right){\varphi _2}\]</p>, <p>Попробуем найти отношение \(\frac{\Delta q}{q}\), для чего раскроем скобки в обеих частях равенства:</p>, <p>\[{\varphi _1} + \frac{{\Delta q}}{q}{\varphi _1} = {\varphi _2} – \frac{{\Delta q}}{q}{\varphi _2}\]</p>, <p>Перенесем все члены с множителем \(\frac{\Delta q}{q}\) в одну сторону, а все остальные – в другую:</p>, <p>\[\frac{{\Delta q}}{q}{\varphi _1} + \frac{{\Delta q}}{q}{\varphi _2} = {\varphi _2} – {\varphi _1}\]</p>, <p>\[\frac{{\Delta q}}{q}\left( {{\varphi _1} + {\varphi _2}} \right) = {\varphi _2} – {\varphi _1}\]</p>, <p>\[\frac{{\Delta q}}{q} = \frac{{{\varphi _2} – {\varphi _1}}}{{{\varphi _1} + {\varphi _2}}}\;\;\;(1)\]</p>, <p>Воспользуемся одной из формул для определения искомого потенциала \(\varphi\) из третьей системы:</p>, <p>\[\varphi = \frac{{q + \Delta q}}{{{C_1}}}\]</p>, <p>Запишем эту в формулу в следующем эквивалентном виде:</p>, <p>\[\varphi = \frac{q}{{{C_1}}}\left( {1 + \frac{{\Delta q}}{q}} \right)\]</p>, <p>Если Вы посмотрите на первую формулу самой первой системы, то поймете, что:</p>, <p>\[\varphi = {\varphi _1}\left( {1 + \frac{{\Delta q}}{q}} \right)\]</p>, <p>Также, учитывая формулу (1), имеем:</p>, <p>\[\varphi = {\varphi _1}\left( {1 + \frac{{{\varphi _2} – {\varphi _1}}}{{{\varphi _1} + {\varphi _2}}}} \right)\]</p>, <p>Сделаем некоторые математические преобразования (в скобках приведем под общий знаменатель):</p>, <p>\[\varphi = {\varphi _1}\left( {\frac{{{\varphi _1} + {\varphi _2} + {\varphi _2} – {\varphi _1}}}{{{\varphi _1} + {\varphi _2}}}} \right)\]</p>, <p>Окончательно получим такую формулу:</p>, <p>\[\varphi = \frac{{2{\varphi _1}{\varphi _2}}}{{{\varphi _1} + {\varphi _2}}}\]</p>, <p>Произведем расчет числового ответа:</p>, <p>\[\varphi = \frac{{2 \cdot 40 \cdot 60}}{{40 + 60}} = 48\;В\]</p>]"
158;[<p>Тысяча одинаковых шарообразных капелек ртути заряжены до одинакового потенциала 0,1 В. Определите потенциал большой шарообразной капли, получившейся в результате слияния малых капель.</p>, <p><em>Задача №6.4.6 из «Сборника задач для подготовки к вступительным экзаменам по физике УГНТУ»</em></p>];"[<p>\(N=1000\), \(\varphi_0=0,1\) В, \(\varphi-?\)</p>, <p>Вы должны понимать, что объем большой шарообразной капли \(V\) равен сумме объемов \(V_0\) всех маленьких капелек ртути, которых согласно условию всего \(N\) штук. Поэтому имеет место равенство:</p>, <p>\[V = N{V_0}\;\;\;(1)\]</p>, <p>Пусть радиус большой капли равен \(R\), радиус маленьких капелек – \(r\), тогда, вспомнив формулу из математики для определения объема шара, можно записать формулу (1) в следующем виде:</p>, <p>\[\frac{4}{3}\pi {R^3} = N \cdot \frac{4}{3}\pi {r^3}\]</p>, <p>\[{R^3} = N{r^3}\]</p>, <p>Откуда:</p>, <p>\[\frac{R}{r} = {N^{\frac{1}{3}}}\;\;\;(2)\]</p>, <p>Запишем формулы для определения электроемкостей большой \(C\) и маленьких \(C_0\) капель:</p>, <p>\[\left\{ \begin{gathered}<br/> C = 4\pi {\varepsilon _0}R \hfill \\<br/> {C_0} = 4\pi {\varepsilon _0}r \hfill \\<br/> \end{gathered} \right.\]</p>, <p>Поделим верхнее равенство на нижнее:</p>, <p>\[\frac{C}{{{C_0}}} = \frac{R}{r}\]</p>, <p>Если учесть ранее полученное (2), имеем:</p>, <p>\[\frac{C}{{{C_0}}} = {N^{\frac{1}{3}}}\;\;\;(3)\]</p>, <p>Из закона сохранения заряда следует, что между зарядом большой капли \(q\) и зарядами \(q_0\) капель в количестве \(N\) штук существует соотношение:</p>, <p>\[q = N{q_0}\]</p>, <p>\[\frac{q}{{{q_0}}} = N\;\;\;(4)\]</p>, <p>Запишем формулы для определения потенциалов большой \(\varphi\) и маленьких \(\varphi_0\) капель через заряды и электроемкости:</p>, <p>\[\left\{ \begin{gathered}<br/> \varphi = \frac{q}{C} \hfill \\<br/> {\varphi _0} = \frac{{{q_0}}}{{{C_0}}} \hfill \\<br/> \end{gathered} \right.\]</p>, <p>Поделим верхнее равенство на нижнее, тогда:</p>, <p>\[\frac{\varphi }{{{\varphi _0}}} = \frac{{q \cdot {C_0}}}{{{q_0} \cdot C}}\]</p>, <p>Учитывая (3) и (4), получим:</p>, <p>\[\frac{\varphi }{{{\varphi _0}}} = \frac{N}{{{N^{\frac{1}{3}}}}}\]</p>, <p>\[\varphi = {\varphi _0}{N^{\frac{2}{3}}}\]</p>, <p>Задача решена в общем виде, считаем ответ:</p>, <p>\[\varphi = 0,1 \cdot {1000^{\frac{2}{3}}} = 10\;В\]</p>]"
159;[<p>Шар радиусом 15 см, заряженный до потенциала 300 В, соединяют проволокой с незаряженным шаром. После соединения шаров их потенциал стал 100 В. Каков радиус второго шара?</p>, <p><em>Задача №6.4.7 из «Сборника задач для подготовки к вступительным экзаменам по физике УГНТУ»</em></p>];"[<p>\(R=15\) см, \(\varphi_0=300\) В, \(\varphi=100\) В, \(r-?\)</p>, <p>Пусть \(q_0\) – это начальный заряд шара радиусом \(R\), \(q_1\) – это конечный (т.е. после соединения с другим шаром) заряд шара радиусом \(R\), \(q_2\) – это конечный заряд шара радиусом \(r\), который изначально не был заряжен. Из закона сохранения заряда следует такое равенство:</p>, <p>\[{q_0} = {q_1} + {q_2}\;\;\;\;(1)\]</p>, <p>После соединения шаров их потенциал станет одинаковым и равным \(\varphi\). Запишем формулы для определения потенциалов \(\varphi_0\) и \(\varphi\) через заряды шаров и их электроемкости.</p>, <p>\[\left\{ \begin{gathered}<br/> {\varphi _0} = \frac{{{q_0}}}{{{C_1}}} \hfill \\<br/> \varphi = \frac{{{q_1}}}{{{C_1}}} \hfill \\<br/> \varphi = \frac{{{q_2}}}{{{C_2}}} \hfill \\<br/> \end{gathered} \right.\]</p>, <p>Давайте запишем формулы для определения электроемкостей шаров с радиусами \(R\) и \(r\), они нам далее понадобятся:</p>, <p>\[\left\{ \begin{gathered}<br/> {C_1} = 4\pi {\varepsilon _0}R \hfill \\<br/> {C_2} = 4\pi {\varepsilon _0}r \hfill \\<br/> \end{gathered} \right.\]</p>, <p>Подставим эти выражения в первую систему, тогда:</p>, <p>\[\left\{ \begin{gathered}<br/> {\varphi _0} = \frac{{{q_0}}}{{4\pi {\varepsilon _0}R}} \hfill \\<br/> \varphi = \frac{{{q_1}}}{{4\pi {\varepsilon _0}R}} \hfill \\<br/> \varphi = \frac{{{q_2}}}{{4\pi {\varepsilon _0}r}} \hfill \\<br/> \end{gathered} \right.\]</p>, <p>Из этой системы получим формулы для определения зарядов \(q_0\), \(q_1\) и \(q_2\):</p>, <p>\[\left\{ \begin{gathered}<br/> {q_0} = 4\pi {\varepsilon _0}R{\varphi _0} \hfill \\<br/> {q_1} = 4\pi {\varepsilon _0}R\varphi \hfill \\<br/> {q_2} = 4\pi {\varepsilon _0}r\varphi \hfill \\<br/> \end{gathered} \right.\]</p>, <p>С учётом этой системы равенство (1) примет такой вид:</p>, <p>\[4\pi {\varepsilon _0}R{\varphi _0} = 4\pi {\varepsilon _0}R\varphi + 4\pi {\varepsilon _0}r\varphi \]</p>, <p>\[R{\varphi _0} = R\varphi + r\varphi \]</p>, <p>Откуда искомый радиус второго шара \(r\) равен:</p>, <p>\[r = \frac{{R\left( {{\varphi _0} – \varphi } \right)}}{\varphi }\]</p>, <p>\[r = R\left( {\frac{{{\varphi _0}}}{\varphi } – 1} \right)\]</p>, <p>Задача решена в общем виде, теперь произведем расчет численного ответа (не забывайте переводить численные значения величин в систему СИ):</p>, <p>\[r = 0,15 \cdot \left( {\frac{{300}}{{100}} – 1} \right) = 0,3\;м\]</p>]"
160;[<p>Шарообразная капля, имеющая потенциал 2,5 В, получена в результате слияния двух одинаковых капелек. Определить, до какого потенциала были заряжены мелкие капельки?</p>, <p><em>Задача №6.4.8 из «Сборника задач для подготовки к вступительным экзаменам по физике УГНТУ»</em></p>];"[<p>\(\varphi=2,5\) В, \(N=2\), \(\varphi_0-?\)</p>, <p>Пусть \(q_0\) – заряд маленьких капель, \(q\) – заряд большой капли, которая получилась при слиянии маленьких, \(C_0\) и \(C\) – электроемкости маленьких и большой капель соответственно. Запишем формулы для определения потенциалов большой \(\varphi\) и маленьких \(\varphi_0\) капель через заряды и электроемкости:</p>, <p>\[\left\{ \begin{gathered}<br/> \varphi = \frac{q}{C} \hfill \\<br/> {\varphi _0} = \frac{{{q_0}}}{{{C_0}}} \hfill \\<br/> \end{gathered} \right.\]</p>, <p>Поделим нижнее равенство на верхнее, тогда:</p>, <p>\[\frac{{{\varphi _0}}}{\varphi } = \frac{{{q_0} \cdot C}}{{q \cdot {C_0}}}\]</p>, <p>\[{\varphi _0} = \varphi \frac{{{q_0} \cdot C}}{{q \cdot {C_0}}}\;\;\;(1)\]</p>, <p>Понятно, что объем большой капли \(V\) равен сумме объемов \(V_0\) двух маленьких капелек. Поэтому имеет место равенство (по условию \(N=2\)):</p>, <p>\[V = N{V_0}\;\;\;(2)\]</p>, <p>Пусть радиус большой капли равен \(R\), радиус маленьких капелек – \(r\), тогда, вспомнив формулу из математики для определения объема шара, можно записать формулу (2) в следующем виде:</p>, <p>\[\frac{4}{3}\pi {R^3} = N \cdot \frac{4}{3}\pi {r^3}\]</p>, <p>\[{R^3} = N{r^3}\]</p>, <p>Откуда:</p>, <p>\[\frac{R}{r} = {N^{\frac{1}{3}}}\;\;\;(3)\]</p>, <p>Запишем формулы для определения электроемкостей большой \(C\) и маленьких \(C_0\) капель:</p>, <p>\[\left\{ \begin{gathered}<br/> C = 4\pi {\varepsilon _0}R \hfill \\<br/> {C_0} = 4\pi {\varepsilon _0}r \hfill \\<br/> \end{gathered} \right.\]</p>, <p>Поделим верхнее равенство на нижнее:</p>, <p>\[\frac{C}{{{C_0}}} = \frac{R}{r}\]</p>, <p>Если учесть ранее полученное (3), имеем:</p>, <p>\[\frac{C}{{{C_0}}} = {N^{\frac{1}{3}}}\;\;\;(4)\]</p>, <p>Из закона сохранения заряда следует, что между зарядом большой капли \(q\) и зарядами \(q_0\) маленьких капель в количестве \(N\) штук существует соотношение:</p>, <p>\[q = N{q_0}\]</p>, <p>\[\frac{{{q_0}}}{q} = \frac{1}{N}\;\;\;(5)\]</p>, <p>Подставим в формулу (1) выражения (4) и (5):</p>, <p>\[{\varphi _0} = \varphi \frac{{{N^{\frac{1}{3}}}}}{N}\]</p>, <p>\[{\varphi _0} = \varphi {N^{ – \frac{2}{3}}}\]</p>, <p> </p>, <p>Мы получили решение задачи в общем виде. Посчитаем ответ:</p>, <p>\[{\varphi _0} = 2,5 \cdot {2^{ – \frac{2}{3}}} = 1,57\;В\]</p>]"
161;[<p>Плоский воздушный конденсатор состоит из двух пластин площадью 100 см<sup>2</sup> каждая. Когда одной из них сообщили заряд 6 нКл, конденсатор зарядился до напряжения 120 В. Определить расстояние между пластинами.</p>, <p><em>Задача №6.4.9 из «Сборника задач для подготовки к вступительным экзаменам по физике УГНТУ»</em></p>];"[<p>\(S=100\) см<sup>2</sup>, \(q=6\) нКл, \(U=120\) В, \(d-?\)</p>, <p>При решении этой задачи почему-то все игнорируют тот факт, что заряд сообщается только одной из обкладок конденсатора, а ведь в таком случае использовать следующую формулу <strong>нельзя</strong>:</p>, <p>\[C = \frac{q}{U}\]</p>, <p>Эту задачу следует решать другим образом. Поле между обкладками конденсатора обусловлено полем заряженной пластины, величину этого поля можно найти по известной формуле (она выводится благодаря теореме Гаусса):</p>, <p>\[E = \frac{\sigma }{{2{\varepsilon _0}}}\;\;\;\;(1)\]</p>, <p>Здесь \(\sigma\) – поверхностная плотность заряда, которую легко определить по следующей формуле:</p>, <p>\[\sigma = \frac{q}{S}\]</p>, <p>Используя это выражение, формулу (1) можно записать в виде:</p>, <p>\[E = \frac{q}{{2{\varepsilon _0}S}}\;\;\;\;(2)\]</p>, <p>Также всем известна формула нахождения напряженности поля \(E\) через напряжение \(U\) и расстояние между обкладками \(d\):</p>, <p>\[E = \frac{U}{d}\;\;\;\;(3)\]</p>, <p>Давайте приравняем (2) и (3):</p>, <p>\[\frac{q}{{2{\varepsilon _0}S}} = \frac{U}{d}\]</p>, <p>Откуда искомое расстояние между обкладками \(d\) равно:</p>, <p>\[d = \frac{{2{\varepsilon _0}SU}}{q}\]</p>, <p>Электрическая постоянная \(\varepsilon _0\) равна 8,85·10<sup>-12</sup> Ф/м. Остается только посчитать ответ, главное в этом деле не забывать переводить численные значения в систему СИ:</p>, <p>\[d = \frac{{2 \cdot 8,85 \cdot {{10}^{ – 12}} \cdot 100 \cdot {{10}^{ – 4}} \cdot 120}}{{6 \cdot {{10}^{ – 9}}}} = 0,00354\;м = 3,54\;мм\]</p>, <p>Если у Вас есть какие-то возражения по поводу правильности решения этой задачи, прошу написать их в комментариях.</p>]"
162;[<p>Определить площадь пластин плоского воздушного конденсатора электроемкостью 1 мкФ, если расстояние между пластинами 1 мм.</p>, <p><em>Задача №6.4.10 из «Сборника задач для подготовки к вступительным экзаменам по физике УГНТУ»</em></p>];"[<p>\(C=1\) мкФ, \(d=1\) мм, \(S-?\)</p>, <p>Электроемкость плоского конденсатора определяется по следующей известной формуле:</p>, <p>\[C = \frac{{\varepsilon {\varepsilon _0}S}}{d}\]</p>, <p>Выразим из этой формулы искомую площадь пластин конденсатора \(S\):</p>, <p>\[S = \frac{{Cd}}{{\varepsilon {\varepsilon _0}}}\]</p>, <p>Задача решена в общем виде, остается только произвести расчет. Напомним, что электрическая постоянная \(\varepsilon _0\) равна 8,85·10<sup>-12</sup> Ф/м, диэлектрическая проницаемость воздуха \(\varepsilon\) равна 1. Не забывайте переводить численные значения величин в систему СИ.</p>, <p>\[S = \frac{{{{10}^{ – 6}} \cdot {{10}^{ – 3}}}}{{1 \cdot 8,85 \cdot {{10}^{ – 12}}}} = 113\;м^2\]</p>, <p>Мы получили какое-то огромное число, тем не менее в ответах в конце сборника указан такой же ответ.</p>]"
163;[<p>Плоский конденсатор составлен из двух круглых пластин диаметром 0,54 м каждая, отделенных друг от друга слоем воздуха толщиной 3·10<sup>-3</sup> м. Напряжение на пластинах конденсатора 100 В. Какой заряд сосредоточен на каждой пластине?</p>, <p><em>Задача №6.4.11 из «Сборника задач для подготовки к вступительным экзаменам по физике УГНТУ»</em></p>];"[<p>\(D=0,54\) м, \(d=3 \cdot 10^{-3}\) м, \(U=100\) В, \(q-?\)</p>, <p>Для начала запишем формулу определения электроемкости плоского конденсатора:</p>, <p>\[C = \frac{{\varepsilon {\varepsilon _0}S}}{d}\;\;\;(1)\]</p>, <p>Поскольку обкладки конденсатора круглые, то площадь пластин \(S\) можно найти по известной из математики формуле:</p>, <p>\[S = \frac{{\pi {D^2}}}{4}\;\;\;(2)\]</p>, <p>Подставим (2) в (1), тогда:</p>, <p>\[C = \frac{{\varepsilon {\varepsilon _0}\pi {D^2}}}{{4d}}\;\;\;(3)\]</p>, <p>Известно, что электроемкость плоского конденсатора можно также найти по формуле:</p>, <p>\[C = \frac{q}{U}\;\;\;(4)\]</p>, <p>Приравняем (3) и (4):</p>, <p>\[\frac{q}{U} = \frac{{\varepsilon {\varepsilon _0}\pi {D^2}}}{{4d}}\]</p>, <p>В итоге, искомый заряд \(q\) следует искать по формуле:</p>, <p>\[q = \frac{{\varepsilon {\varepsilon _0}\pi {D^2}U}}{{4d}}\]</p>, <p>Мы получили решение задачи в общем виде. Напоминаем, что электрическая постоянная \(\varepsilon _0\) равна 8,85·10<sup>-12</sup> Ф/м, диэлектрическая проницаемость воздуха \(\varepsilon\) равна 1. Переводите численные значения величин в систему СИ и считайте ответ.</p>, <p>\[q = \frac{{1 \cdot 8,85 \cdot {{10}^{ – 12}} \cdot 3,14 \cdot {{0,54}^2} \cdot 100}}{{4 \cdot 3 \cdot {{10}^{ – 3}}}} = 67,5 \cdot {10^{ – 9}}\;Кл = 67,5\;нКл\]</p>, <p>Обе обкладки конденсатора заряжены одинаковыми по модулю, но разными по знаку зарядами. Модуль заряда обкладок равен 67,5 нКл.</p>]"
164;[<p>Плоский воздушный конденсатор погрузили в керосин. Во сколько раз изменилась его электроемкость?</p>, <p><em>Задача №6.4.12 из «Сборника задач для подготовки к вступительным экзаменам по физике УГНТУ»</em></p>];[<p>\({\varepsilon _2} = 2\), \(\frac{C_2}{C_1}-?\)</p>, <p>После погружения между обкладками конденсатора будет находиться керосин, который имеет диэлектрическую проницаемость \({\varepsilon _2}\), равную 2. До погружения в пространстве между обкладками находился воздух с диэлектрической проницаемостью \({\varepsilon _2}\), равной 1.</p>, <p>Запишем формулу для определения электроемкости конденсатора в общем случае:</p>, <p>\[C = \frac{{\varepsilon {\varepsilon _0}S}}{d}\]</p>, <p>Распишем эту формулу применительно к говорящимся в задаче двум случаям:</p>, <p>\[\left\{ \begin{gathered}<br/> {C_1} = \frac{{{\varepsilon _1}{\varepsilon _0}S}}{d} \hfill \\<br/> {C_2} = \frac{{{\varepsilon _2}{\varepsilon _0}S}}{d} \hfill \\<br/> \end{gathered} \right.\]</p>, <p>Найдем искомое отношение \(\frac{C_2}{C_1}\), разделив нижнее равенство на верхнее:</p>, <p>\[\frac{{{C_2}}}{{{C_1}}} = \frac{{{\varepsilon _2}}}{{{\varepsilon _1}}}\]</p>, <p>Посчитаем ответ:</p>, <p>\[\frac{{{C_2}}}{{{C_1}}} = \frac{2}{1} = 2\]</p>, <p>Мы видим, что электроемкость увеличится в 2 раза.</p>]
